{
  "$schema": "http://json-schema.org/draft-07/schema#",
  "$id": "https://megamek-web.app/schemas/unit.json",
  "title": "BattleTech Unit",
  "description": "Schema for serialized BattleTech unit definitions (BattleMechs, vehicles, etc.)",
  "type": "object",
  "required": ["id", "unitType"],
  "properties": {
    "id": {
      "type": "string",
      "minLength": 1,
      "pattern": "^\\S+$",
      "description": "Unique identifier for the unit. The converter preserves source punctuation and Unicode, so IDs must be non-empty and whitespace-free."
    },
    "chassis": {
      "type": "string",
      "minLength": 1,
      "description": "Chassis name (e.g., 'Atlas')"
    },
    "model": {
      "type": "string",
      "description": "Model designation (e.g., 'AS7-D')"
    },
    "variant": {
      "type": "string",
      "description": "Optional variant name"
    },
    "unitType": {
      "type": "string",
      "enum": [
        "BattleMech",
        "OmniMech",
        "IndustrialMech",
        "ProtoMech",
        "Vehicle",
        "VTOL",
        "Aerospace",
        "Conventional Fighter",
        "Small Craft",
        "DropShip",
        "JumpShip",
        "WarShip",
        "Space Station",
        "Infantry",
        "Battle Armor",
        "BattleArmor",
        "Support Vehicle",
        "SupportVehicle",
        "ConventionalFighter",
        "SmallCraft",
        "BATTLEARMOR"
      ],
      "description": "Type of unit"
    },
    "configuration": {
      "type": "string",
      "enum": ["Biped", "Quad", "Tripod", "LAM", "QuadVee"],
      "description": "Mech configuration"
    },
    "techBase": {
      "type": "string",
      "enum": ["INNER_SPHERE", "CLAN", "MIXED"],
      "description": "Technology base"
    },
    "rulesLevel": {
      "type": "string",
      "enum": [
        "INTRODUCTORY",
        "STANDARD",
        "ADVANCED",
        "EXPERIMENTAL",
        "UNOFFICIAL"
      ],
      "description": "Rules level/complexity"
    },
    "era": {
      "type": "string",
      "description": "BattleTech era identifier"
    },
    "year": {
      "type": "integer",
      "minimum": 1000,
      "maximum": 9999,
      "description": "Introduction year"
    },
    "tonnage": {
      "type": "number",
      "minimum": 0,
      "maximum": 250,
      "description": "Unit tonnage"
    },
    "engine": {
      "type": "object",
      "required": ["type"],
      "properties": {
        "type": {
          "type": "string",
          "enum": [
            "FUSION",
            "XL",
            "CLAN_XL",
            "LIGHT",
            "COMPACT",
            "XXL",
            "ICE",
            "FUEL_CELL",
            "FISSION",
            "FLYWHEEL",
            "BATTERY"
          ],
          "description": "Engine type"
        },
        "rating": {
          "type": "integer",
          "minimum": 0,
          "maximum": 1000,
          "description": "Engine rating"
        }
      },
      "additionalProperties": false
    },
    "gyro": {
      "type": "object",
      "required": ["type"],
      "properties": {
        "type": {
          "type": "string",
          "enum": [
            "STANDARD",
            "XL",
            "COMPACT",
            "HEAVY_DUTY",
            "SUPERHEAVY",
            "NONE"
          ],
          "description": "Gyro type"
        }
      },
      "additionalProperties": false
    },
    "cockpit": {
      "type": "string",
      "enum": [
        "STANDARD",
        "SMALL",
        "COMMAND_CONSOLE",
        "TORSO_MOUNTED",
        "PRIMITIVE",
        "INDUSTRIAL",
        "SUPERHEAVY",
        "SUPERHEAVY_TRIPOD",
        "INTERFACE",
        "QUADVEE",
        "PRIMITIVE_INDUSTRIAL"
      ],
      "description": "Cockpit type"
    },
    "structure": {
      "type": "object",
      "required": ["type"],
      "properties": {
        "type": {
          "type": "string",
          "enum": [
            "STANDARD",
            "ENDO_STEEL",
            "ENDO_STEEL_CLAN",
            "ENDO_COMPOSITE",
            "REINFORCED",
            "COMPOSITE",
            "INDUSTRIAL",
            "ENDO_COMPOSITE_CLAN"
          ],
          "description": "Internal structure type"
        }
      },
      "additionalProperties": false
    },
    "armor": {
      "type": "object",
      "required": ["type"],
      "properties": {
        "type": {
          "type": "string",
          "enum": [
            "STANDARD",
            "FERRO_FIBROUS",
            "FERRO_FIBROUS_CLAN",
            "LIGHT_FERRO_FIBROUS",
            "HEAVY_FERRO_FIBROUS",
            "STEALTH",
            "REACTIVE",
            "REFLECTIVE",
            "HARDENED",
            "PRIMITIVE",
            "INDUSTRIAL",
            "HEAVY_INDUSTRIAL",
            "COMMERCIAL",
            "IMPACT_RESISTANT",
            "FERRO_LAMELLOR",
            "FIRE_RESISTANT",
            "MIMETIC",
            "STEALTH_IMPROVED",
            "STEALTH_PROTOTYPE",
            "REACTIVE_CLAN",
            "REFLECTIVE_CLAN",
            "BAR_2",
            "BAR_4",
            "BAR_5",
            "BAR_6",
            "BAR_7",
            "BAR_9"
          ],
          "description": "Armor type"
        },
        "allocation": {
          "type": "object",
          "description": "Armor points per location",
          "additionalProperties": {
            "oneOf": [
              {
                "type": "integer",
                "minimum": 0
              },
              {
                "type": "object",
                "required": ["front", "rear"],
                "properties": {
                  "front": {
                    "type": "integer",
                    "minimum": 0
                  },
                  "rear": {
                    "type": "integer",
                    "minimum": 0
                  }
                },
                "additionalProperties": false
              }
            ]
          }
        },
        "byLocation": {
          "type": "object",
          "description": "Armor points per vehicle location",
          "additionalProperties": {
            "type": "integer",
            "minimum": 0
          }
        },
        "byArc": {
          "type": "object",
          "description": "Armor points per aerospace arc",
          "additionalProperties": {
            "type": "integer",
            "minimum": 0
          }
        },
        "perTrooper": {
          "type": "integer",
          "minimum": 0,
          "description": "Battle armor points per trooper"
        }
      },
      "anyOf": [
        {
          "type": "object",
          "required": ["allocation"],
          "properties": {
            "allocation": {
              "type": "object",
              "additionalProperties": {
                "oneOf": [
                  {
                    "type": "integer",
                    "minimum": 0
                  },
                  {
                    "type": "object",
                    "required": ["front", "rear"],
                    "properties": {
                      "front": {
                        "type": "integer",
                        "minimum": 0
                      },
                      "rear": {
                        "type": "integer",
                        "minimum": 0
                      }
                    },
                    "additionalProperties": false
                  }
                ]
              }
            }
          }
        },
        {
          "type": "object",
          "required": ["byLocation"],
          "properties": {
            "byLocation": {
              "type": "object",
              "additionalProperties": {
                "type": "integer",
                "minimum": 0
              }
            }
          }
        },
        {
          "type": "object",
          "required": ["byArc"],
          "properties": {
            "byArc": {
              "type": "object",
              "additionalProperties": {
                "type": "integer",
                "minimum": 0
              }
            }
          }
        },
        {
          "type": "object",
          "required": ["perTrooper"],
          "properties": {
            "perTrooper": {
              "type": "integer",
              "minimum": 0
            }
          }
        }
      ],
      "additionalProperties": false
    },
    "heatSinks": {
      "type": "object",
      "required": ["type", "count"],
      "properties": {
        "type": {
          "type": "string",
          "enum": ["SINGLE", "DOUBLE", "DOUBLE_CLAN", "COMPACT", "LASER"],
          "description": "Heat sink type"
        },
        "count": {
          "type": "integer",
          "minimum": 0,
          "description": "Total number of heat sinks"
        }
      },
      "additionalProperties": false
    },
    "movement": {
      "type": "object",
      "required": [],
      "properties": {
        "walk": {
          "type": "integer",
          "minimum": 0,
          "description": "Walking MP"
        },
        "jump": {
          "type": "integer",
          "minimum": 0,
          "description": "Jumping MP"
        },
        "jumpJetType": {
          "type": "string",
          "enum": ["STANDARD", "IMPROVED", "MECHANICAL", "UMU"],
          "description": "Jump jet type"
        },
        "enhancements": {
          "type": "array",
          "items": {
            "type": "string"
          },
          "description": "Movement enhancements (MASC, Supercharger, etc.)"
        }
      },
      "additionalProperties": true
    },
    "equipment": {
      "type": "array",
      "items": {
        "type": "object",
        "required": ["id", "location"],
        "properties": {
          "id": {
            "type": "string",
            "description": "Equipment ID reference"
          },
          "name": {
            "type": "string",
            "description": "Source display name for the mounted equipment"
          },
          "location": {
            "type": "string",
            "description": "Mounting location"
          },
          "slots": {
            "type": "array",
            "items": {
              "type": "integer"
            },
            "description": "Specific slot indices"
          },
          "isRearMounted": {
            "type": "boolean",
            "default": false,
            "description": "Whether weapon is rear-facing"
          },
          "linkedAmmo": {
            "type": "string",
            "description": "Linked ammunition ID"
          },
          "isRemovable": {
            "type": "boolean",
            "description": "Whether the mounted item can be removed in the customizer"
          },
          "isOmniPodMounted": {
            "type": "boolean",
            "description": "Whether the mounted item belongs to an OmniMech pod"
          }
        },
        "additionalProperties": false
      },
      "description": "Mounted equipment list"
    },
    "criticalSlots": {
      "type": "object",
      "description": "Critical slot assignments per location",
      "additionalProperties": {
        "type": "array",
        "items": {
          "oneOf": [
            {
              "type": "string"
            },
            {
              "type": "null"
            }
          ]
        }
      }
    },
    "quirks": {
      "type": "array",
      "items": {
        "type": "string"
      },
      "description": "Unit quirks"
    },
    "fluff": {
      "type": "object",
      "properties": {
        "overview": {
          "type": "string"
        },
        "capabilities": {
          "type": "string"
        },
        "history": {
          "type": "string"
        },
        "deployment": {
          "type": "string"
        },
        "variants": {
          "type": "string"
        },
        "notableUnits": {
          "type": "string"
        },
        "manufacturer": {
          "type": "string"
        },
        "primaryFactory": {
          "type": "string"
        },
        "systemManufacturer": {
          "type": "object",
          "additionalProperties": {
            "type": "string"
          }
        }
      },
      "additionalProperties": false,
      "description": "Fluff/flavor text"
    },
    "sourceDefinition": {
      "type": "object",
      "description": "Originating source definition, independent of editor or campaign instance identity",
      "required": ["source", "id"],
      "additionalProperties": false,
      "properties": {
        "source": { "type": "string", "enum": ["canonical", "custom"] },
        "id": { "type": "string", "minLength": 1 },
        "version": { "type": "integer", "minimum": 1 }
      }
    },
    "mulId": {
      "anyOf": [
        { "type": "integer" },
        { "type": "string", "pattern": "^[0-9-]+$" }
      ],
      "description": "Master Unit List identifier; legacy integer or lossless editor text"
    },
    "role": {
      "type": "string",
      "description": "Combat role"
    },
    "source": {
      "type": "string",
      "description": "Source book/publication"
    }
  },
  "additionalProperties": true,
  "allOf": [
    {
      "if": {
        "required": ["unitType"],
        "properties": {
          "unitType": {
            "enum": ["BattleMech", "OmniMech", "IndustrialMech"]
          }
        }
      },
      "then": {
        "required": [
          "id",
          "chassis",
          "model",
          "unitType",
          "configuration",
          "techBase",
          "rulesLevel",
          "era",
          "year",
          "tonnage",
          "engine",
          "gyro",
          "cockpit",
          "structure",
          "armor",
          "heatSinks",
          "movement",
          "equipment",
          "criticalSlots"
        ]
      }
    },
    {
      "if": {
        "required": ["unitType"],
        "properties": {
          "unitType": {
            "enum": ["BattleMech", "OmniMech", "IndustrialMech"]
          }
        }
      },
      "then": {
        "properties": {
          "movement": {
            "required": ["walk", "jump"]
          }
        }
      }
    }
  ]
}
