{
  "id": "emperor-emp-6me-mercury-elite",
  "chassis": "Emperor",
  "model": "EMP-6ME 'Mercury Elite'",
  "unitType": "BattleMech",
  "configuration": "Biped",
  "techBase": "INNER_SPHERE",
  "rulesLevel": "UNOFFICIAL",
  "era": "CIVIL_WAR",
  "year": 3075,
  "tonnage": 90,
  "engine": {
    "type": "LIGHT",
    "rating": 270
  },
  "gyro": {
    "type": "STANDARD"
  },
  "cockpit": "STANDARD",
  "structure": {
    "type": "ENDO_STEEL"
  },
  "armor": {
    "type": "STANDARD",
    "allocation": {
      "LEFT_ARM": 29,
      "RIGHT_ARM": 29,
      "LEFT_TORSO": {
        "front": 28,
        "rear": 9
      },
      "RIGHT_TORSO": {
        "front": 28,
        "rear": 9
      },
      "CENTER_TORSO": {
        "front": 40,
        "rear": 13
      },
      "HEAD": 9,
      "LEFT_LEG": 35,
      "RIGHT_LEG": 35
    }
  },
  "heatSinks": {
    "type": "DOUBLE",
    "count": 11
  },
  "movement": {
    "walk": 3,
    "jump": 0
  },
  "equipment": [
    {
      "id": "1-issbgr",
      "location": "LEFT_ARM,_AMMO:32"
    },
    {
      "id": "1-issbgr",
      "location": "RIGHT_ARM"
    },
    {
      "id": "1-issnppc",
      "location": "LEFT_ARM"
    },
    {
      "id": "1-issnppc",
      "location": "RIGHT_ARM"
    },
    {
      "id": "1-ismediumpulselaser",
      "location": "RIGHT_TORSO"
    },
    {
      "id": "1-ismediumpulselaser",
      "location": "LEFT_TORSO"
    },
    {
      "id": "1-isc3slaveunit",
      "location": "HEAD"
    }
  ],
  "criticalSlots": {
    "LEFT_ARM": [
      "Shoulder",
      "Upper Arm Actuator",
      "Lower Arm Actuator",
      "ISSBGR",
      "ISSBGR",
      "ISSBGR",
      "ISSBGR",
      "ISSBGR",
      "ISSBGR",
      "ISSBGR",
      "ISSNPPC",
      "ISSNPPC"
    ],
    "RIGHT_ARM": [
      "Shoulder",
      "Upper Arm Actuator",
      "Lower Arm Actuator",
      "ISSBGR",
      "ISSBGR",
      "ISSBGR",
      "ISSBGR",
      "ISSBGR",
      "ISSBGR",
      "ISSBGR",
      "ISSNPPC",
      "ISSNPPC"
    ],
    "LEFT_TORSO": [
      "Engine",
      "Engine",
      "ISMediumPulseLaser",
      "ISSBGaussRifleAmmo",
      "ISSBGaussRifleAmmo",
      "Endo-Steel",
      "Endo-Steel",
      "Endo-Steel",
      "Endo-Steel",
      "Endo-Steel",
      "Endo-Steel",
      null
    ],
    "RIGHT_TORSO": [
      "Engine",
      "Engine",
      "ISDouble Heat Sink",
      "ISDouble Heat Sink",
      "ISDouble Heat Sink",
      "ISMediumPulseLaser",
      "ISSBGaussRifleAmmo",
      "ISSBGaussRifleAmmo",
      "Endo-Steel",
      "Endo-Steel",
      "Endo-Steel",
      "Endo-Steel"
    ],
    "CENTER_TORSO": [
      "Engine",
      "Engine",
      "Engine",
      "Gyro",
      "Gyro",
      "Gyro",
      "Gyro",
      "Engine",
      "Engine",
      "Engine",
      null,
      null
    ],
    "HEAD": [
      "Life Support",
      "Sensors",
      "Cockpit",
      "ISC3SlaveUnit",
      "Sensors",
      "Life Support"
    ],
    "LEFT_LEG": [
      "Hip",
      "Upper Leg Actuator",
      "Lower Leg Actuator",
      "Foot Actuator",
      "Endo-Steel",
      "Endo-Steel"
    ],
    "RIGHT_LEG": [
      "Hip",
      "Upper Leg Actuator",
      "Lower Leg Actuator",
      "Foot Actuator",
      "Endo-Steel",
      "Endo-Steel"
    ]
  },
  "quirks": [
    "command_mech"
  ],
  "mulId": 969,
  "role": "Juggernaut",
  "source": "JTP:Atreus"
}