{
  "id": "wendigo-vp-prime",
  "chassis": "Wendigo-VP",
  "model": "(Prime)",
  "unitType": "BattleMech",
  "configuration": "Biped",
  "techBase": "CLAN",
  "rulesLevel": "UNOFFICIAL",
  "era": "DARK_AGE",
  "year": 3134,
  "tonnage": 50,
  "engine": {
    "type": "CLAN_XL",
    "rating": 250
  },
  "gyro": {
    "type": "STANDARD"
  },
  "cockpit": "STANDARD",
  "structure": {
    "type": "ENDO_STEEL_CLAN"
  },
  "armor": {
    "type": "REFLECTIVE",
    "allocation": {
      "LEFT_ARM": 16,
      "RIGHT_ARM": 16,
      "LEFT_TORSO": {
        "front": 16,
        "rear": 5
      },
      "RIGHT_TORSO": {
        "front": 16,
        "rear": 5
      },
      "CENTER_TORSO": {
        "front": 22,
        "rear": 8
      },
      "HEAD": 8,
      "LEFT_LEG": 20,
      "RIGHT_LEG": 20
    }
  },
  "heatSinks": {
    "type": "DOUBLE",
    "count": 10
  },
  "movement": {
    "walk": 5,
    "jump": 4
  },
  "equipment": [
    {
      "id": "lb-10-x-ac",
      "location": "LEFT_ARM"
    },
    {
      "id": "er-ppc",
      "location": "RIGHT_ARM"
    },
    {
      "id": "medium-pulse-laser",
      "location": "RIGHT_ARM"
    },
    {
      "id": "medium-pulse-laser",
      "location": "RIGHT_ARM"
    },
    {
      "id": "er-small-laser",
      "location": "HEAD"
    }
  ],
  "criticalSlots": {
    "LEFT_ARM": [
      "Shoulder",
      "Upper Arm Actuator",
      "CLLBXAC10 (omnipod)",
      "CLLBXAC10 (omnipod)",
      "CLLBXAC10 (omnipod)",
      "CLLBXAC10 (omnipod)",
      "CLLBXAC10 (omnipod)",
      "Clan LB 10-X AC Ammo (omnipod)",
      "Clan LB 10-X Cluster Ammo (omnipod)",
      "Clan Reflective",
      "Clan Reflective",
      "Clan Reflective"
    ],
    "RIGHT_ARM": [
      "Shoulder",
      "Upper Arm Actuator",
      "CLERPPC (omnipod)",
      "CLERPPC (omnipod)",
      "CLMediumPulseLaser (omnipod)",
      "CLMediumPulseLaser (omnipod)",
      "Clan Endo Steel",
      "Clan Endo Steel",
      "Clan Endo Steel",
      null,
      null,
      null
    ],
    "LEFT_TORSO": [
      "Fusion Engine",
      "Fusion Engine",
      "Life Support",
      "Jump Jet (omnipod)",
      "Jump Jet (omnipod)",
      "Clan Endo Steel",
      "Clan Endo Steel",
      "Clan Reflective",
      null,
      null,
      null,
      null
    ],
    "RIGHT_TORSO": [
      "Fusion Engine",
      "Fusion Engine",
      "Life Support",
      "Jump Jet (omnipod)",
      "Jump Jet (omnipod)",
      "Clan Endo Steel",
      "Clan Endo Steel",
      "Clan Reflective",
      null,
      null,
      null,
      null
    ],
    "CENTER_TORSO": [
      "Fusion Engine",
      "Fusion Engine",
      "Fusion Engine",
      "Gyro",
      "Gyro",
      "Gyro",
      "Gyro",
      "Fusion Engine",
      "Fusion Engine",
      "Fusion Engine",
      "Cockpit",
      "Sensors"
    ],
    "HEAD": [
      "Sensors",
      "Sensors",
      "CLERSmallLaser (omnipod)",
      null,
      null,
      null
    ],
    "LEFT_LEG": [
      "Hip",
      "Upper Leg Actuator",
      "Lower Leg Actuator",
      "Foot Actuator",
      null,
      null
    ],
    "RIGHT_LEG": [
      "Hip",
      "Upper Leg Actuator",
      "Lower Leg Actuator",
      "Foot Actuator",
      null,
      null
    ]
  },
  "mulId": 6408,
  "role": "Skirmisher",
  "source": "TR:3145:DC"
}