{
  "id": "imp-c",
  "chassis": "Imp",
  "model": "C",
  "unitType": "BattleMech",
  "configuration": "Biped",
  "techBase": "CLAN",
  "rulesLevel": "ADVANCED",
  "era": "SUCCESSION_WARS",
  "year": 2863,
  "tonnage": 100,
  "engine": {
    "type": "FUSION",
    "rating": 300
  },
  "gyro": {
    "type": "STANDARD"
  },
  "cockpit": "STANDARD",
  "structure": {
    "type": "STANDARD"
  },
  "armor": {
    "type": "STANDARD",
    "allocation": {
      "LEFT_ARM": 34,
      "RIGHT_ARM": 34,
      "LEFT_TORSO": {
        "front": 32,
        "rear": 10
      },
      "RIGHT_TORSO": {
        "front": 32,
        "rear": 10
      },
      "CENTER_TORSO": {
        "front": 44,
        "rear": 15
      },
      "HEAD": 9,
      "LEFT_LEG": 42,
      "RIGHT_LEG": 42
    }
  },
  "heatSinks": {
    "type": "DOUBLE",
    "count": 25
  },
  "movement": {
    "walk": 3,
    "jump": 0
  },
  "equipment": [
    {
      "id": "1-cllrm20",
      "location": "RIGHT_ARM,_AMMO:18"
    },
    {
      "id": "1-clmediumpulselaser",
      "location": "LEFT_ARM"
    },
    {
      "id": "1-clerppc",
      "location": "RIGHT_TORSO"
    },
    {
      "id": "1-clmediumpulselaser",
      "location": "RIGHT_TORSO"
    },
    {
      "id": "1-clerppc",
      "location": "LEFT_TORSO"
    },
    {
      "id": "1-clmediumpulselaser",
      "location": "LEFT_TORSO"
    },
    {
      "id": "2-clmediumpulselaser",
      "location": "CENTER_TORSO"
    }
  ],
  "criticalSlots": {
    "LEFT_ARM": [
      "Shoulder",
      "Upper Arm Actuator",
      "CLDouble Heat Sink",
      "CLDouble Heat Sink",
      "CLDouble Heat Sink",
      "CLDouble Heat Sink",
      "CLDouble Heat Sink",
      "CLDouble Heat Sink",
      "CLMediumPulseLaser",
      null,
      null,
      null
    ],
    "RIGHT_ARM": [
      "Shoulder",
      "Upper Arm Actuator",
      "Lower Arm Actuator",
      "CLDouble Heat Sink",
      "CLDouble Heat Sink",
      "CLLRM20",
      "CLLRM20",
      "CLLRM20",
      "CLLRM20",
      "CLArtemisIV",
      null,
      null
    ],
    "LEFT_TORSO": [
      "CLDouble Heat Sink",
      "CLDouble Heat Sink",
      "CLDouble Heat Sink",
      "CLDouble Heat Sink",
      "CLDouble Heat Sink",
      "CLDouble Heat Sink",
      "CLERPPC",
      "CLERPPC",
      "CLMediumPulseLaser",
      "CLLRM20 Ammo (Clan) Artemis-capable",
      "CLLRM20 Ammo (Clan) Artemis-capable",
      "CLLRM20 Ammo (Clan) Artemis-capable"
    ],
    "RIGHT_TORSO": [
      "CLDouble Heat Sink",
      "CLDouble Heat Sink",
      "CLDouble Heat Sink",
      "CLDouble Heat Sink",
      "CLDouble Heat Sink",
      "CLDouble Heat Sink",
      "CLDouble Heat Sink",
      "CLDouble Heat Sink",
      "CLERPPC",
      "CLERPPC",
      "CLMediumPulseLaser",
      null
    ],
    "CENTER_TORSO": [
      "Fusion Engine",
      "Fusion Engine",
      "Fusion Engine",
      "Gyro",
      "Gyro",
      "Gyro",
      "Gyro",
      "Fusion Engine",
      "Fusion Engine",
      "Fusion Engine",
      "CLMediumPulseLaser",
      "CLMediumPulseLaser"
    ],
    "HEAD": [
      "Life Support",
      "Sensors",
      "Cockpit",
      null,
      "Sensors",
      "Life Support"
    ],
    "LEFT_LEG": [
      "Hip",
      "Upper Leg Actuator",
      "Lower Leg Actuator",
      "Foot Actuator",
      "CLDouble Heat Sink",
      "CLDouble Heat Sink"
    ],
    "RIGHT_LEG": [
      "Hip",
      "Upper Leg Actuator",
      "Lower Leg Actuator",
      "Foot Actuator",
      "CLDouble Heat Sink",
      "CLDouble Heat Sink"
    ]
  },
  "quirks": [
    "command_mech",
    "difficult_maintain"
  ],
  "mulId": 1606,
  "role": "Juggernaut",
  "source": "TR:3050"
}