{
  "id": "excalibur-exc-c1-cernunnos",
  "chassis": "Excalibur",
  "model": "EXC-C1 (Cernunnos)",
  "unitType": "BattleMech",
  "configuration": "Biped",
  "techBase": "INNER_SPHERE",
  "rulesLevel": "ADVANCED",
  "era": "CLAN_INVASION",
  "year": 3062,
  "tonnage": 70,
  "engine": {
    "type": "XL",
    "rating": 350
  },
  "gyro": {
    "type": "STANDARD"
  },
  "cockpit": "STANDARD",
  "structure": {
    "type": "STANDARD"
  },
  "armor": {
    "type": "STANDARD",
    "allocation": {
      "LEFT_ARM": 20,
      "RIGHT_ARM": 20,
      "LEFT_TORSO": {
        "front": 23,
        "rear": 7
      },
      "RIGHT_TORSO": {
        "front": 23,
        "rear": 7
      },
      "CENTER_TORSO": {
        "front": 36,
        "rear": 7
      },
      "HEAD": 9,
      "LEFT_LEG": 20,
      "RIGHT_LEG": 20
    }
  },
  "heatSinks": {
    "type": "DOUBLE",
    "count": 11
  },
  "movement": {
    "walk": 5,
    "jump": 0
  },
  "equipment": [
    {
      "id": "1-iserppc",
      "location": "RIGHT_ARM"
    },
    {
      "id": "1-ismediumlaser",
      "location": "LEFT_ARM"
    },
    {
      "id": "1-ismediumlaser",
      "location": "LEFT_ARM"
    },
    {
      "id": "1-islbxac20",
      "location": "CENTER_TORSO,_AMMO:15"
    },
    {
      "id": "1-isguardianecm",
      "location": "RIGHT_TORSO"
    }
  ],
  "criticalSlots": {
    "LEFT_ARM": [
      "Shoulder",
      "Upper Arm Actuator",
      "Lower Arm Actuator",
      "Hand Actuator",
      "ISMediumLaser",
      "ISMediumLaser",
      null,
      null,
      null,
      null,
      null,
      null
    ],
    "RIGHT_ARM": [
      "Shoulder",
      "Upper Arm Actuator",
      "Lower Arm Actuator",
      "ISERPPC",
      "ISERPPC",
      "ISERPPC",
      null,
      null,
      null,
      null,
      null,
      null
    ],
    "LEFT_TORSO": [
      "Engine",
      "Engine",
      "Engine",
      "ISLBXAC20",
      "ISLBXAC20",
      "ISLBXAC20",
      "ISLBXAC20",
      "ISLBXAC20",
      "ISLBXAC20",
      "ISLBXAC20",
      "ISLBXAC20",
      "ISLBXAC20"
    ],
    "RIGHT_TORSO": [
      "Engine",
      "Engine",
      "Engine",
      "ISGuardianECM",
      "ISGuardianECM",
      "ISLBXAC20 CL Ammo",
      "ISLBXAC20 CL Ammo",
      "ISLBXAC20 Ammo",
      null,
      null,
      null,
      "ISCASE"
    ],
    "CENTER_TORSO": [
      "Engine",
      "Engine",
      "Engine",
      "Gyro",
      "Gyro",
      "Gyro",
      "Gyro",
      "Engine",
      "Engine",
      "Engine",
      "ISLBXAC20",
      "ISLBXAC20"
    ],
    "HEAD": [
      "Life Support",
      "Sensors",
      "Cockpit",
      null,
      "Sensors",
      "Life Support"
    ],
    "LEFT_LEG": [
      "Hip",
      "Upper Leg Actuator",
      "Lower Leg Actuator",
      "Foot Actuator",
      null,
      null
    ],
    "RIGHT_LEG": [
      "Hip",
      "Upper Leg Actuator",
      "Lower Leg Actuator",
      "Foot Actuator",
      null,
      null
    ]
  },
  "quirks": [
    "vestigial_hands_la",
    "vestigial_hands_ra"
  ],
  "mulId": 1001,
  "role": "Skirmisher",
  "source": "RS:UM"
}