{
  "id": "dig-king-rcl-1-miningmech-mod",
  "chassis": "Dig King",
  "model": "RCL-1 MiningMech MOD",
  "unitType": "BattleMech",
  "configuration": "Biped",
  "techBase": "INNER_SPHERE",
  "rulesLevel": "EXPERIMENTAL",
  "era": "SUCCESSION_WARS",
  "year": 2802,
  "tonnage": 35,
  "engine": {
    "type": "FUEL_CELL",
    "rating": 105
  },
  "gyro": {
    "type": "STANDARD"
  },
  "cockpit": "STANDARD",
  "structure": {
    "type": "INDUSTRIAL"
  },
  "armor": {
    "type": "INDUSTRIAL",
    "allocation": {
      "LEFT_ARM": 10,
      "RIGHT_ARM": 10,
      "LEFT_TORSO": {
        "front": 10,
        "rear": 3
      },
      "RIGHT_TORSO": {
        "front": 10,
        "rear": 3
      },
      "CENTER_TORSO": {
        "front": 11,
        "rear": 4
      },
      "HEAD": 9,
      "LEFT_LEG": 13,
      "RIGHT_LEG": 13
    }
  },
  "heatSinks": {
    "type": "SINGLE",
    "count": 2
  },
  "movement": {
    "walk": 3,
    "jump": 0
  },
  "equipment": [
    {
      "id": "machine-gun",
      "location": "LEFT_ARM"
    },
    {
      "id": "machine-gun",
      "location": "LEFT_ARM"
    },
    {
      "id": "srm-4",
      "location": "LEFT_TORSO"
    },
    {
      "id": "srm-4",
      "location": "LEFT_TORSO"
    }
  ],
  "criticalSlots": {
    "LEFT_ARM": [
      "Shoulder",
      "Upper Arm Actuator",
      "Lower Arm Actuator",
      "Machine Gun",
      "Machine Gun",
      "IS Machine Gun Ammo - Half",
      null,
      null,
      null,
      null,
      null,
      null
    ],
    "RIGHT_ARM": [
      "Shoulder",
      "Upper Arm Actuator",
      "Lower Arm Actuator",
      "Rock Cutter",
      "Rock Cutter",
      "Rock Cutter",
      "Rock Cutter",
      "Rock Cutter",
      null,
      null,
      null,
      null
    ],
    "LEFT_TORSO": [
      "SRM 4",
      "SRM 4",
      "IS Ammo SRM-4",
      null,
      null,
      null,
      null,
      null,
      null,
      null,
      null,
      null
    ],
    "RIGHT_TORSO": [
      null,
      null,
      null,
      null,
      null,
      null,
      null,
      null,
      null,
      null,
      null,
      null
    ],
    "CENTER_TORSO": [
      "Fusion Engine",
      "Fusion Engine",
      "Fusion Engine",
      "Gyro",
      "Gyro",
      "Gyro",
      "Gyro",
      "Fusion Engine",
      "Fusion Engine",
      "Fusion Engine",
      null,
      null
    ],
    "HEAD": [
      "Life Support",
      "Sensors",
      "Cockpit",
      null,
      "Sensors",
      "Life Support"
    ],
    "LEFT_LEG": [
      "Hip",
      "Upper Leg Actuator",
      "Lower Leg Actuator",
      "Foot Actuator",
      null,
      null
    ],
    "RIGHT_LEG": [
      "Hip",
      "Upper Leg Actuator",
      "Lower Leg Actuator",
      "Foot Actuator",
      null,
      null
    ]
  },
  "mulId": 7172,
  "role": "Brawler",
  "source": "RS:VA"
}