{
  "id": "phoenix-hawk-pxh-1c-special",
  "chassis": "Phoenix Hawk",
  "model": "PXH-1c 'Special'",
  "unitType": "BattleMech",
  "configuration": "Biped",
  "techBase": "INNER_SPHERE",
  "rulesLevel": "UNOFFICIAL",
  "era": "STAR_LEAGUE",
  "year": 2765,
  "tonnage": 45,
  "engine": {
    "type": "XL",
    "rating": 270
  },
  "gyro": {
    "type": "STANDARD"
  },
  "cockpit": "STANDARD",
  "structure": {
    "type": "ENDO_STEEL"
  },
  "armor": {
    "type": "STANDARD",
    "allocation": {
      "LEFT_ARM": 12,
      "RIGHT_ARM": 12,
      "LEFT_TORSO": {
        "front": 18,
        "rear": 4
      },
      "RIGHT_TORSO": {
        "front": 18,
        "rear": 4
      },
      "CENTER_TORSO": {
        "front": 23,
        "rear": 5
      },
      "HEAD": 8,
      "LEFT_LEG": 20,
      "RIGHT_LEG": 20
    }
  },
  "heatSinks": {
    "type": "DOUBLE",
    "count": 10
  },
  "movement": {
    "walk": 6,
    "jump": 6
  },
  "equipment": [
    {
      "id": "medium-laser",
      "location": "LEFT_ARM"
    },
    {
      "id": "machine-gun",
      "location": "LEFT_ARM"
    },
    {
      "id": "snub-nose-ppc",
      "location": "RIGHT_ARM"
    },
    {
      "id": "medium-laser",
      "location": "RIGHT_ARM"
    },
    {
      "id": "machine-gun",
      "location": "RIGHT_ARM"
    },
    {
      "id": "er-large-laser",
      "location": "RIGHT_TORSO"
    }
  ],
  "criticalSlots": {
    "LEFT_ARM": [
      "Shoulder",
      "Upper Arm Actuator",
      "Lower Arm Actuator",
      "Hand Actuator",
      "Medium Laser",
      "Machine Gun",
      "IS Endo Steel",
      "IS Endo Steel",
      "IS Endo Steel",
      null,
      null,
      null
    ],
    "RIGHT_ARM": [
      "Shoulder",
      "Upper Arm Actuator",
      "Lower Arm Actuator",
      "Hand Actuator",
      "ISSNPPC",
      "ISSNPPC",
      "Medium Laser",
      "Machine Gun",
      "IS Endo Steel",
      "IS Endo Steel",
      null,
      null
    ],
    "LEFT_TORSO": [
      "Fusion Engine",
      "Fusion Engine",
      "Fusion Engine",
      "Jump Jet",
      "Jump Jet",
      "Jump Jet",
      "IS Ammo MG - Full",
      "ISCASE",
      "IS Endo Steel",
      "IS Endo Steel",
      null,
      null
    ],
    "RIGHT_TORSO": [
      "Fusion Engine",
      "Fusion Engine",
      "Fusion Engine",
      "Jump Jet",
      "Jump Jet",
      "Jump Jet",
      "ISERLargeLaser",
      "ISERLargeLaser",
      "IS Endo Steel",
      "IS Endo Steel",
      null,
      null
    ],
    "CENTER_TORSO": [
      "Fusion Engine",
      "Fusion Engine",
      "Fusion Engine",
      "Gyro",
      "Gyro",
      "Gyro",
      "Gyro",
      "Fusion Engine",
      "Fusion Engine",
      "Fusion Engine",
      "ISGuardianECMSuite",
      "ISGuardianECMSuite"
    ],
    "HEAD": [
      "Life Support",
      "Sensors",
      "Cockpit",
      "IS Endo Steel",
      "Sensors",
      "Life Support"
    ],
    "LEFT_LEG": [
      "Hip",
      "Upper Leg Actuator",
      "Lower Leg Actuator",
      "Foot Actuator",
      "IS Endo Steel",
      "IS Endo Steel"
    ],
    "RIGHT_LEG": [
      "Hip",
      "Upper Leg Actuator",
      "Lower Leg Actuator",
      "Foot Actuator",
      "IS Endo Steel",
      "IS Endo Steel"
    ]
  },
  "quirks": [
    "command_mech",
    "ubiquitous_clan",
    "ubiquitous_is",
    "imp_com"
  ],
  "mulId": 2493,
  "role": "Striker",
  "source": "TR:3075"
}