{
  "id": "arcas-unknown",
  "chassis": "Arcas",
  "model": "Unknown",
  "unitType": "BattleMech",
  "configuration": "Biped",
  "techBase": "CLAN",
  "rulesLevel": "ADVANCED",
  "era": "CLAN_INVASION",
  "year": 3061,
  "tonnage": 65,
  "engine": {
    "type": "XL",
    "rating": 325
  },
  "gyro": {
    "type": "STANDARD"
  },
  "cockpit": "STANDARD",
  "structure": {
    "type": "ENDO_STEEL"
  },
  "armor": {
    "type": "STANDARD",
    "allocation": {
      "LEFT_ARM": 20,
      "RIGHT_ARM": 20,
      "LEFT_TORSO": {
        "front": 22,
        "rear": 8
      },
      "RIGHT_TORSO": {
        "front": 22,
        "rear": 8
      },
      "CENTER_TORSO": {
        "front": 32,
        "rear": 10
      },
      "HEAD": 9,
      "LEFT_LEG": 30,
      "RIGHT_LEG": 30
    }
  },
  "heatSinks": {
    "type": "DOUBLE",
    "count": 15
  },
  "movement": {
    "walk": 5,
    "jump": 5
  },
  "equipment": [
    {
      "id": "1-clerlargelaser",
      "location": "RIGHT_ARM"
    },
    {
      "id": "1-clerlargelaser",
      "location": "LEFT_ARM"
    },
    {
      "id": "1-clmediumpulselaser",
      "location": "RIGHT_TORSO"
    },
    {
      "id": "1-clstreaksrm4",
      "location": "RIGHT_TORSO,_AMMO:25"
    },
    {
      "id": "1-clmediumpulselaser",
      "location": "LEFT_TORSO"
    },
    {
      "id": "1-clstreaksrm4",
      "location": "LEFT_TORSO"
    },
    {
      "id": "1-clstreaksrm4",
      "location": "CENTER_TORSO"
    }
  ],
  "criticalSlots": {
    "LEFT_ARM": [
      "Shoulder",
      "Upper Arm Actuator",
      "Lower Arm Actuator",
      "CLDouble Heat Sink",
      "CLDouble Heat Sink",
      "CLERLargeLaser",
      null,
      null,
      null,
      null,
      null,
      null
    ],
    "RIGHT_ARM": [
      "Shoulder",
      "Upper Arm Actuator",
      "Lower Arm Actuator",
      "CLDouble Heat Sink",
      "CLDouble Heat Sink",
      "CLERLargeLaser",
      null,
      null,
      null,
      null,
      null,
      null
    ],
    "LEFT_TORSO": [
      "Fusion Engine",
      "Fusion Engine",
      "CLMediumPulseLaser",
      "CLStreakSRM4",
      "Endo Steel",
      "Endo Steel",
      "Endo Steel",
      null,
      null,
      null,
      null,
      null
    ],
    "RIGHT_TORSO": [
      "Fusion Engine",
      "Fusion Engine",
      "CLMediumPulseLaser",
      "CLStreakSRM4",
      "CLStreakSRM4 Ammo",
      "Endo Steel",
      "Endo Steel",
      "Endo Steel",
      null,
      null,
      null,
      null
    ],
    "CENTER_TORSO": [
      "Fusion Engine",
      "Fusion Engine",
      "Fusion Engine",
      "Gyro",
      "Gyro",
      "Gyro",
      "Gyro",
      "Fusion Engine",
      "Fusion Engine",
      "Fusion Engine",
      "Jump Jet",
      "CLStreakSRM4"
    ],
    "HEAD": [
      "Life Support",
      "Sensors",
      "Cockpit",
      "Endo Steel",
      "Sensors",
      "Life Support"
    ],
    "LEFT_LEG": [
      "Hip",
      "Upper Leg Actuator",
      "Lower Leg Actuator",
      "Foot Actuator",
      "Jump Jet",
      "Jump Jet"
    ],
    "RIGHT_LEG": [
      "Hip",
      "Upper Leg Actuator",
      "Lower Leg Actuator",
      "Foot Actuator",
      "Jump Jet",
      "Jump Jet"
    ]
  },
  "quirks": [
    "pro_actuator"
  ],
  "mulId": 3717,
  "role": "Skirmisher",
  "source": "TR:3067"
}