{
  "id": "omni-corvis-b",
  "chassis": "Omni-Corvis",
  "model": "B",
  "unitType": "BattleMech",
  "configuration": "Biped",
  "techBase": "CLAN",
  "rulesLevel": "ADVANCED",
  "era": "SUCCESSION_WARS",
  "year": 2921,
  "tonnage": 50,
  "engine": {
    "type": "FUSION",
    "rating": 250
  },
  "gyro": {
    "type": "STANDARD"
  },
  "cockpit": "STANDARD",
  "structure": {
    "type": "ENDO_STEEL_CLAN"
  },
  "armor": {
    "type": "FERRO_FIBROUS_CLAN",
    "allocation": {
      "LEFT_ARM": 15,
      "RIGHT_ARM": 15,
      "LEFT_TORSO": {
        "front": 16,
        "rear": 6
      },
      "RIGHT_TORSO": {
        "front": 16,
        "rear": 6
      },
      "CENTER_TORSO": {
        "front": 24,
        "rear": 7
      },
      "HEAD": 8,
      "LEFT_LEG": 20,
      "RIGHT_LEG": 20
    }
  },
  "heatSinks": {
    "type": "DOUBLE_CLAN",
    "count": 10
  },
  "movement": {
    "walk": 5,
    "jump": 0
  },
  "equipment": [
    {
      "id": "lrm-20",
      "location": "LEFT_ARM"
    },
    {
      "id": "lrm-20",
      "location": "RIGHT_ARM"
    },
    {
      "id": "machine-gun",
      "location": "LEFT_TORSO"
    },
    {
      "id": "machine-gun",
      "location": "LEFT_TORSO"
    },
    {
      "id": "narc",
      "location": "RIGHT_TORSO"
    }
  ],
  "criticalSlots": {
    "LEFT_ARM": [
      "Shoulder",
      "Upper Arm Actuator",
      "Lower Arm Actuator",
      "Hand Actuator",
      "CLLRM20 (OMNIPOD)",
      "CLLRM20 (OMNIPOD)",
      "CLLRM20 (OMNIPOD)",
      "CLLRM20 (OMNIPOD)",
      "Clan Ammo LRM-20 (Clan) Narc-capable (OMNIPOD)",
      "Clan Ammo LRM-20 (Clan) Narc-capable (OMNIPOD)",
      "Clan Ammo LRM-20 (Clan) Narc-capable (OMNIPOD)",
      null
    ],
    "RIGHT_ARM": [
      "Shoulder",
      "Upper Arm Actuator",
      "Lower Arm Actuator",
      "Hand Actuator",
      "CLLRM20 (OMNIPOD)",
      "CLLRM20 (OMNIPOD)",
      "CLLRM20 (OMNIPOD)",
      "CLLRM20 (OMNIPOD)",
      "Clan Ammo LRM-20 (Clan) Narc-capable (OMNIPOD)",
      "Clan Ammo LRM-20 (Clan) Narc-capable (OMNIPOD)",
      "Clan Ammo LRM-20 (Clan) Narc-capable (OMNIPOD)",
      null
    ],
    "LEFT_TORSO": [
      "CLMG (OMNIPOD)",
      "CLMG (OMNIPOD)",
      "Clan Machine Gun Ammo - Half (OMNIPOD)",
      "Clan Endo Steel",
      "Clan Endo Steel",
      "Clan Endo Steel",
      "Clan Endo Steel",
      "Clan Endo Steel",
      null,
      null,
      null,
      null
    ],
    "RIGHT_TORSO": [
      "CLNarcBeacon (OMNIPOD)",
      "CLNarc Pods (OMNIPOD)",
      "CLNarc Pods (OMNIPOD)",
      "Clan Ferro-Fibrous",
      "Clan Ferro-Fibrous",
      "Clan Ferro-Fibrous",
      "Clan Ferro-Fibrous",
      "Clan Ferro-Fibrous",
      null,
      null,
      null,
      null
    ],
    "CENTER_TORSO": [
      "Fusion Engine",
      "Fusion Engine",
      "Fusion Engine",
      "Gyro",
      "Gyro",
      "Gyro",
      "Gyro",
      "Fusion Engine",
      "Fusion Engine",
      "Fusion Engine",
      null,
      null
    ],
    "HEAD": [
      "Life Support",
      "Sensors",
      "Cockpit",
      null,
      "Sensors",
      "Life Support"
    ],
    "LEFT_LEG": [
      "Hip",
      "Upper Leg Actuator",
      "Lower Leg Actuator",
      "Foot Actuator",
      "Clan Endo Steel",
      "Clan Endo Steel"
    ],
    "RIGHT_LEG": [
      "Hip",
      "Upper Leg Actuator",
      "Lower Leg Actuator",
      "Foot Actuator",
      "Clan Ferro-Fibrous",
      "Clan Ferro-Fibrous"
    ]
  },
  "quirks": [
    "prototype"
  ],
  "mulId": 7612,
  "role": "Missile Boat",
  "source": "TR:GC"
}